{
  "schema_version": "1.0",
  "lead_id": "lead_001",
  "target": "authorized-demo-target",
  "scope_status": "authorized",
  "state": "report_ready",
  "title": "Unchecked external call may break accounting invariant",
  "claim": "A state update may occur after an external call, allowing the accounting invariant to be violated if control flow is re-entered.",
  "scope": "authorized-demo-target is in scope; accounting invariant impact is an in-scope asset-loss category.",
  "mechanism": "withdraw() calls the external token transfer before zeroing the caller's tracked balance, so a reentrant callback observes stale accounting state.",
  "falsifier": "If withdraw() zeroes the balance before the external call (checks-effects-interactions order), the theory is dead.",
  "repro_plan": "Foundry test: deploy a malicious receiver that reenters withdraw() from its callback and assert the balance underflows or double-pays.",
  "impact_boundary": "Reentrant caller can drain up to the full tracked balance of any other depositor sharing the same accounting slot.",
  "evidence_refs": [
    "evidence/lead_001/hypothesis.md",
    "evidence/lead_001/foundry_repro.t.sol",
    "evidence/lead_001/forge_output.txt",
    "evidence/lead_001/evidence_bundle.json"
  ],
  "review_refs": [
    "reviews/lead_001/council_review.md"
  ],
  "created_at": "2026-07-03T00:00:00Z",
  "updated_at": "2026-07-03T00:30:00Z",
  "events": [
    {
      "event_id": "evt_001",
      "lead_id": "lead_001",
      "from_state": null,
      "to_state": "signal",
      "actor": "trinity",
      "reason": "Initial signal created from authorized analysis.",
      "evidence_refs": [],
      "created_at": "2026-07-03T00:00:00Z"
    },
    {
      "event_id": "evt_002",
      "lead_id": "lead_001",
      "from_state": "signal",
      "to_state": "hypothesis",
      "actor": "trinity",
      "reason": "Signal was converted into a falsifiable hypothesis.",
      "evidence_refs": [],
      "created_at": "2026-07-03T00:05:00Z"
    },
    {
      "event_id": "evt_003",
      "lead_id": "lead_001",
      "from_state": "hypothesis",
      "to_state": "repro_attempted",
      "actor": "forge",
      "reason": "A reproduction test was created and executed.",
      "evidence_refs": [
        "evidence/lead_001/foundry_repro.t.sol",
        "evidence/lead_001/forge_output.txt"
      ],
      "created_at": "2026-07-03T00:15:00Z"
    },
    {
      "event_id": "evt_004",
      "lead_id": "lead_001",
      "from_state": "repro_attempted",
      "to_state": "reproduced_real",
      "actor": "evidence-gate",
      "reason": "Reproduction output demonstrated repeatable impact.",
      "evidence_refs": [
        "evidence/lead_001/hypothesis.md"
      ],
      "created_at": "2026-07-03T00:20:00Z"
    },
    {
      "event_id": "evt_005",
      "lead_id": "lead_001",
      "from_state": "reproduced_real",
      "to_state": "council_accepted",
      "actor": "council",
      "reason": "Reviewer accepted scope, impact, and reproduction quality.",
      "evidence_refs": [
        "reviews/lead_001/council_review.md"
      ],
      "created_at": "2026-07-03T00:25:00Z"
    },
    {
      "event_id": "evt_006",
      "lead_id": "lead_001",
      "from_state": "council_accepted",
      "to_state": "report_ready",
      "actor": "anchor",
      "reason": "Evidence bundle and report narrative were archived.",
      "evidence_refs": [
        "evidence/lead_001/evidence_bundle.json"
      ],
      "created_at": "2026-07-03T00:30:00Z"
    }
  ]
}
